{
  "name": "Corporate Blue",
  "description": "Professional blue theme for business presentations",
  "aspect_ratio": "16:9",
  "colors": {
    "primary": "#2c5aa0",
    "secondary": "#28a745",
    "accent": "#ffc107",
    "background": "#ffffff",
    "text_primary": "#333333",
    "text_secondary": "#666666",
    "success": "#28a745",
    "warning": "#ffc107",
    "error": "#dc3545"
  },
  "fonts": {
    "heading": {
      "family": "Arial",
      "weight": "bold"
    },
    "body": {
      "family": "Arial",
      "weight": "normal"
    }
  },
  "sizes": {
    "title": 44,
    "subtitle": 32,
    "section_header": 40,
    "slide_title": 32,
    "body": 24,
    "caption": 18
  },
  "spacing": {
    "margin_top": 0.5,
    "margin_bottom": 0.5,
    "margin_left": 0.5,
    "margin_right": 0.5,
    "content_gap": 0.25
  }
}
