{
  "name": "Educational",
  "description": "Academic-focused theme with calming colors for lectures and training",
  "aspect_ratio": "16:9",
  "colors": {
    "primary": "#1976d2",
    "secondary": "#388e3c",
    "accent": "#0097a7",
    "background": "#f5f5f5",
    "text_primary": "#263238",
    "text_secondary": "#546e7a",
    "success": "#43a047",
    "warning": "#fb8c00",
    "error": "#e53935"
  },
  "fonts": {
    "heading": {
      "family": "Arial",
      "weight": "bold"
    },
    "body": {
      "family": "Arial",
      "weight": "normal"
    }
  },
  "sizes": {
    "title": 44,
    "subtitle": 32,
    "section_header": 40,
    "slide_title": 32,
    "body": 24,
    "caption": 18
  },
  "spacing": {
    "margin_top": 0.5,
    "margin_bottom": 0.5,
    "margin_left": 0.5,
    "margin_right": 0.5,
    "content_gap": 0.25
  }
}
