{
  "name": "Minimal",
  "description": "Clean and minimal design with maximum readability and focus",
  "aspect_ratio": "16:9",
  "colors": {
    "primary": "#0066cc",
    "secondary": "#5a5a5a",
    "accent": "#0066cc",
    "background": "#ffffff",
    "text_primary": "#2d2d2d",
    "text_secondary": "#8c8c8c",
    "success": "#28a745",
    "warning": "#ffc107",
    "error": "#dc3545"
  },
  "fonts": {
    "heading": {
      "family": "Arial",
      "weight": "bold"
    },
    "body": {
      "family": "Arial",
      "weight": "normal"
    }
  },
  "sizes": {
    "title": 44,
    "subtitle": 32,
    "section_header": 40,
    "slide_title": 32,
    "body": 24,
    "caption": 18
  },
  "spacing": {
    "margin_top": 0.5,
    "margin_bottom": 0.5,
    "margin_left": 0.5,
    "margin_right": 0.5,
    "content_gap": 0.25
  }
}
